{
    "scene": "dreamcity",
    "scene_text": [
      {
        "conditions": [],
        "output": "Exploring the city, you make note of the details. Suddenly, you hear a voice behind you."
      },
      {
        "conditions": [],
        "style": "character name",
        "output": "\n\n????: "
      },
      {
        "conditions": [],
        "output": "\"Hey! What are you doing!?\""
      }
    ],
    "events": [
      {
        "type": "music_change",
        "value": "2"
      }
    ],
    "choices": [
      {
        "conditions": [],
        "text": "Inspect the ground.",
        "events": [
          {
            "type": "popup",
            "value": [
              "You bend down to examine the strange material beneath you. As you touch it, fleeting images flash before your eyes. Dreams, vivid and surreal, seem to be embedded in the very fabric of this dreamfield. It's as if the ground itself holds the memories and fantasies of countless dreamers.",
              "..."
            ]
          }
        ]
      }
    ]
  }