{
    "scene": "cabin_knock",
    "scene_text": [
        {
            "conditions": [
            ],
            "output": "You muster up some courage to knock on the cabin door. After a short while, it opens. A large blue horse-like dog-like creature bearing 4 legs, 4 arms, 4 antenna, and 3 eyes stares at you curiously from the entrance. "
        }
    ],
    "events": [
        {
            "type": "set_flag",
            "value": "seen_quadrolax"
        },
        {
            "type": "play_sound",
            "value": "door_knock_and_open"
        }
    ],
    "choices": [
        {
            "conditions": [
            ],
            "text": "Fight (attack it)!",
            "events": [
            ]
        },
        {
            "conditions": [
            ],
            "text": "Freeze (stand there in shock like an idiot)!",
            "events": [
                {
                    "type": "change_scene",
                    "value": "cabin_quadrolax_freeze"
                }
            ]
        },
        {
            "conditions": [
            ],
            "text": "Fawn (greet it)!",
            "events": [
            ]
        },
        {
            "conditions": [
            ],
            "text": "Flight (run away)!",
            "events": [
                {
                    "type": "change_scene",
                    "value": "cabin_invest"
                }
            ]
        }
    ]
}
