{
    "scene": "fields",
    "scene_text": [
        {
            "conditions": [
            ],
            "output": "You find yourself amidst a grassy field, flowers decorate the otherwise empty plains. A wooden sign points to all 4 cardinal directions."
        }
    ],
    "events": [
        {
            "type": "music_change",
            "value": 1
        }
    ],
    "choices": [
        {
            "conditions": [
            ],
            "text": "Go north.",
            "events": [
                {
                    "type": "change_scene",
                    "value": "cabin"
                }
            ]
        },
        {
            "conditions": [
            ],
            "text": "Go east.",
            "events": [
                {
                    "type": "change_scene",
                    "value": "snowy_mountains"
                }
            ]
        },
        {
            "conditions": [
            ],
            "text": "Go south.",
            "events": [
                {
                    "type": "change_scene",
                    "value": "blue_gate"
                }
            ]
        },
        {
            "conditions": [
            ],
            "text": "Go west.",
            "events": [
                {
                    "type": "change_scene",
                    "value": "desert"
                }
            ]
        }
    ]
}