{
    "scene": "town",
    "scene_text": [
        {
            "conditions": [
                {
                    "type": "flag",
                    "key": "seen_quadrolax",
                    "value": false
                }
            ],
            "output": "You approach the center of the town, several buildings for different purposes are aviable to walk into. Some creatures in the distance seem to be interacting, but you cant quite make out what they are."
        },
        {
            "conditions": [
                {
                    "type": "flag",
                    "key": "seen_quadrolax",
                    "value": true
                }
            ],
            "output": "You approach the center of the town, several buildings for different purposes are aviable to walk into. Some different colors of that blue creature in the distance seem to be interacting. You wonder what they even are."
        }
    ],
    "events": [
    ],
    "choices": [
        {
            "conditions": [
            ],
            "text": "Go to the saloon.",
            "events": [
                {
                    "type": "change_scene",
                    "value": "town_saloon"
                }
            ]
        },
        {
            "conditions": [
            ],
            "text": "Go to the general store.",
            "events": [
                {
                    "type": "change_scene",
                    "value": "town_store"
                }
            ]
        },
        {
            "conditions": [
            ],
            "text": "Go to the jail.",
            "events": [
                {
                    "type": "change_scene",
                    "value": "town_jail"
                }
            ]
        },
        {
            "conditions": [
            ],
            "text": "Go to the restaurant.",
            "events": [
                {
                    "type": "change_scene",
                    "value": "town_restaurant"
                }
            ]
        },
        {
            "conditions": [
            ],
            "text": "Go back.",
            "events": [
                {
                    "type": "change_scene",
                    "value": "desert"
                }
            ]
        }
    ]
}