{
    "scene": "cabin_break_in",
    "scene_text": [
        {
            "conditions": [],
            "output": "You flop onto the floor of the cabin hitting yourself on the kitchen sink. Whoever owns this place hasn't noticed your appearance yet."
        }
    ],
    "events": [
        {
            "type": "set_flag",
            "value": "cabin_broke_in"
        },
        {
            "type": "music_change",
            "value": "sneaky snitch"
        },
        {
            "type": "play_sound",
            "value": "woodbreak_big4"
        }
    ],
    "choices": [
        {
            "conditions": [],
            "text": "Attempt to hide.",
            "events": [
                {
                    "type": "change_scene",
                    "value": "cabin_hide"
                }
            ]
        },
        {
            "conditions": [],
            "text": "Stand your ground.",
            "events": [
                {
                    "type": "change_scene",
                    "value": "cabin_break_in_stand"
                }
            ]
        },
        {
            "conditions": [],
            "text": "Get the heck out of there!",
            "events": [
                {
                    "type": "change_scene",
                    "value": "cabin"
                }
            ]
        }
    ]
}
