{
    "scene": "cabin_elsewhere",
    "scene_text": [
        {
            "conditions": [
            ],
            "output": "Elsewhere around the cabin, cherry fruit trees dot the landscape. Cherries have fallen from the skies and more continue to fall."
        }
    ],
    "events": [
    ],
    "choices": [
        {
            "conditions": [
            ],
            "text": "Take some cherries.",
            "events": [
                {
                    "type": "change_scene",
                    "value": "cabin_take_cherries"
                }
            ]
        },
        {
            "conditions": [
            ],
            "text": "Go further in.",
            "events": [
                {
                    "type": "change_scene",
                    "value": "cabin_elsewhere_further"
                }
            ]
        },
        {
            "conditions": [
            ],
            "text": "Go back.",
            "events": [
                {
                    "type": "change_scene",
                    "value": "cabin"
                }
            ]
        }
    ]
}