{
    "scene": "cabin_quadrolax_inside",
    "scene_text": [
        {
            "conditions": [],
            "output": "The creature leads you to the table to sit, then walks off to the windowsill. The chair you sat in is quite comfy, especially with the neon pink pillow cushioning your bum. The table has a purple cloth across it, it matches the bold wallpaper. The floor has a neon pink carpet too. A lot of the wooden objects here are dark in color."
        }
    ],
    "events": [
        {
            "type": "music_change",
            "value": 6
        }
    ],
    "choices": [
        {
            "conditions": [
            ],
            "text": "Wait...",
            "events": [
                {
                    "type": "change_scene",
                    "value": "cabin_quadrolax_inside_pie"
                }
            ]
        },
        {
            "conditions": [
            ],
            "text": "Make a distraction!",
            "events": [
                {
                    "type": "change_scene",
                    "value": "cabin_quadrolax_inside_distract"
                }
            ]
        },
        {
            "conditions": [
            ],
            "text": "\"Gotta go!\"",
            "events": [
                {
                    "type": "set_flag",
                    "value": "cabin_quadrolax_rude_leave"
                },
                {
                    "type": "change_scene",
                    "value": "cabin_invest"
                }
            ]
        }
    ]
}
